id,interest_area,major,short_description,career_paths,prerequisites
426,Computers and Data Science,Data Engineering,"Data Engineering is a specialized major focused on the methods and technology used to collect, manage, process, and convert raw data into usable information for analysis and insights. This major combines aspects of computer science, applied mathematics, and statistical methods to prepare students for handling large-scale data environments.","Data Engineer, Database Administrator, Data Architect, Data Analyst, Machine Learning Engineer, Big Data Engineer, Business Intelligence Developer, Systems Engineer","{""IB"":[""IB Computer Science HL"",""IB Mathematics HL"",""IB Physics HL""],""A-Levels"":[""A-Level Computer Science"",""A-Level Mathematics"",""A-Level Further Mathematics"",""A-Level Physics""],""AP"":[""AP Computer Science A"",""AP Calculus BC"",""AP Statistics"",""AP Physics C: Mechanics""],""MYP"":[""MYP Design"",""MYP Mathematics Extended""],""GCSE"":[""GCSE Computer Science"",""GCSE Mathematics"",""GCSE Physics""],""CBSE"":[""CBSE Computer Science"",""CBSE Mathematics"",""CBSE Physics""]}"
427,Computers and Data Science,Quantum Computing,"Quantum Computing is a field that intersects computer science, physics, and mathematics to develop and utilize quantum-mechanical phenomena such as superposition and entanglement for processing information. This major provides students with a deep understanding of quantum algorithms, quantum mechanics, and their applications in solving complex computational problems.","Quantum algorithm developer, Quantum software engineer, Quantum researcher, Data scientist specializing in quantum computing, Quantum hardware engineer, Cryptographer focusing on quantum cryptography, Quantum computing consultant, Academic researcher in quantum sciences","{""IB"":[""IB Mathematics HL"",""IB Physics HL"",""IB Computer Science HL""],""A-Levels"":[""A-Level Mathematics"",""A-Level Further Mathematics"",""A-Level Physics""],""AP"":[""AP Calculus BC"",""AP Physics C: Mechanics"",""AP Computer Science A""],""MYP"":[""MYP Extended Mathematics"",""MYP Physical and Earth Sciences""],""GCSE"":[""GCSE Mathematics"",""GCSE Physics"",""GCSE Computer Science""],""CBSE"":[""CBSE Mathematics"",""CBSE Physics"",""CBSE Computer Science""]}"
428,Computers and Data Science,Computer Systems Analysis,"Computer Systems Analysis is a major that focuses on the design and evaluation of computer systems, emphasizing the integration of software and hardware with business and organizational needs. Students learn to analyze user requirements, develop appropriate system functionalities, and ensure efficient and effective operations through technological applications.","Systems Analyst, IT Consultant, Data Analyst, Network Administrator, Business Analyst, Software Developer, Project Manager, Quality Assurance Analyst","{""IB"":[""IB Computer Science HL"",""IB Mathematics HL"",""IB Physics SL""],""A-Levels"":[""A-Level Computer Science"",""A-Level Mathematics"",""A-Level Further Mathematics""],""AP"":[""AP Computer Science A"",""AP Calculus AB"",""AP Statistics""],""MYP"":[""MYP Design"",""MYP Mathematics""],""GCSE"":[""GCSE Computer Science"",""GCSE Mathematics""],""CBSE"":[""CBSE Computer Science"",""CBSE Mathematics""]}"
429,Computers and Data Science,Digital Forensics,"Digital Forensics is a specialized field within cybersecurity focusing on the recovery and investigation of material found in digital devices, often related to computer crime. The major equips students with the skills to analyze data, understand legal issues, and apply forensic tools and methodologies to solve problems.","Cybersecurity Analyst, Digital Forensics Investigator, Information Security Officer, Forensic Computer Analyst, Incident Response Analyst, Law Enforcement Officer, Network Security Specialist, Compliance and Enforcement Officer","{""IB"":[""IB Computer Science HL"",""IB Mathematics HL"",""IB Physics SL"",""IB Information Technology in a Global Society HL""],""A-Levels"":[""A-Level Computer Science"",""A-Level Mathematics"",""A-Level Further Mathematics"",""A-Level Physics""],""AP"":[""AP Computer Science A"",""AP Calculus AB"",""AP Statistics"",""AP Physics C: Mechanics""],""MYP"":[""MYP Design"",""MYP Mathematics"",""MYP Sciences""],""GCSE"":[""GCSE Computer Science"",""GCSE Mathematics"",""GCSE Physics""],""CBSE"":[""CBSE Computer Science"",""CBSE Mathematics"",""CBSE Physics""]}"
430,Computers and Data Science,Bioinformatics,"Bioinformatics is an interdisciplinary field that combines biology, computer science, and information technology to analyze and interpret biological data. It involves the development and application of computational tools and techniques to capture and analyze complex biological data, such as genetic sequences.","Bioinformatics scientist, Computational biologist, Genomics analyst, Bioinformatics software developer, Systems biologist, Clinical research associate, Data scientist in biotechnology, Bioinformatics consultant","{""IB"":[""IB Biology HL"",""IB Computer Science HL"",""IB Mathematics HL"",""IB Chemistry SL""],""A-Levels"":[""A-Level Biology"",""A-Level Mathematics"",""A-Level Computer Science"",""A-Level Chemistry""],""AP"":[""AP Biology"",""AP Computer Science A"",""AP Calculus AB"",""AP Statistics""],""MYP"":[""MYP Sciences"",""MYP Mathematics"",""MYP Design""],""GCSE"":[""GCSE Biology"",""GCSE Mathematics"",""GCSE Computer Science""],""CBSE"":[""CBSE Biology"",""CBSE Mathematics"",""CBSE Informatics Practices"",""CBSE Physical Education (for well-rounded development)""]}"
431,Design,Graphic Design,"Graphic Design is a dynamic and creative major focused on visual communication and presentation, utilizing skills in art, technology, and media to convey messages effectively. Students in this field learn to create graphic content for print, digital media, branding, advertising, and multimedia applications.","Graphic designer, Art director, Brand identity designer, UI/UX designer, Web designer, Multimedia artist, Packaging designer, Creative director","{""IB"":[""IB Visual Arts HL"",""IB Design Technology SL"",""IB Information Technology in a Global Society HL""],""A-Levels"":[""A-Level Art and Design"",""A-Level Graphic Communication"",""A-Level Media Studies""],""AP"":[""AP Studio Art: 2-D Design"",""AP Studio Art: Drawing"",""AP Computer Science A""],""MYP"":[""MYP Design"",""MYP Visual Art"",""MYP Technology""],""GCSE"":[""GCSE Art and Design"",""GCSE Design and Technology"",""GCSE Information and Communication Technology""],""CBSE"":[""CBSE Fine Arts"",""CBSE Graphics"",""CBSE Multimedia and Web Technology""]}"
432,Design,Industrial Design,"Industrial Design focuses on the creation and development of products used by consumers, combining art, business, and engineering to craft products that are both functional and aesthetically pleasing. The major emphasizes problem-solving, user experience, and material sustainability, preparing students to design products that enhance daily life.","Product Designer, Industrial Design Researcher, User Experience (UX) Designer, Automotive Designer, Furniture Designer, Toy Designer, Packaging Designer, Exhibit Designer","{""IB"":[""IB Visual Arts HL"",""IB Design Technology HL"",""IB Business Management HL"",""IB Mathematics SL"",""IB Physics SL""],""A-Levels"":[""A-Level Design and Technology"",""A-Level Art and Design"",""A-Level Mathematics"",""A-Level Physics"",""A-Level Business Studies""],""AP"":[""AP Studio Art: 3-D Design"",""AP Calculus AB"",""AP Physics 1"",""AP Psychology"",""AP Statistics""],""MYP"":[""MYP Design"",""MYP Visual Art"",""MYP Mathematics"",""MYP Sciences""],""GCSE"":[""GCSE Design and Technology"",""GCSE Art and Design"",""GCSE Mathematics"",""GCSE Physics"",""GCSE Business Studies""],""CBSE"":[""CBSE Fine Arts"",""CBSE Physical Education"",""CBSE Mathematics"",""CBSE Physics"",""CBSE Business Studies""]}"
433,Design,Fashion Design,"Fashion Design is a creative major that focuses on the art of designing clothing and accessories. This field combines artistic skills with practical implementation, often including technology and innovative materials in the design process.","Fashion Designer, Textile Designer, Fashion Stylist, Visual Merchandiser, Fashion Buyer, Costume Designer, Fashion Illustrator, Creative Director","{""IB"":[""IB Visual Arts HL"",""IB Design Technology HL"",""IB Business Management HL""],""A-Levels"":[""A-Level Art and Design"",""A-Level Textiles"",""A-Level Business Studies""],""AP"":[""AP Studio Art: 2-D Design"",""AP Studio Art: 3-D Design"",""AP Art History""],""MYP"":[""MYP Design"",""MYP Visual Art""],""GCSE"":[""GCSE Art and Design"",""GCSE Textiles Technology"",""GCSE Business Studies""],""CBSE"":[""CBSE Fine Arts"",""CBSE Home Science"",""CBSE Economics""]}"
434,Design,Interior Design,"Interior Design is a creative and technical major focusing on the optimization of interior spaces to improve functionality and aesthetics. Students learn to plan, design, and manage spaces considering both style and efficiency.","Interior Designer, Space Planner, Visual Merchandiser, Exhibition Designer, Furniture Designer, Lighting Designer, Set Designer, Design Consultant","{""IB"":[""IB Visual Arts HL"",""IB Design Technology HL"",""IB Mathematics SL""],""A-Levels"":[""A-Level Art and Design"",""A-Level Design and Technology"",""A-Level Mathematics""],""AP"":[""AP Studio Art: 2-D Design"",""AP Studio Art: 3-D Design"",""AP Art History""],""MYP"":[""MYP Design"",""MYP Visual Art""],""GCSE"":[""GCSE Art and Design"",""GCSE Design and Technology""],""CBSE"":[""CBSE Fine Arts"",""CBSE Home Science"",""CBSE Mathematics""]}"
435,Design,Product Design,"Product Design is a creative field focused on the process of designing and creating functional and aesthetic products that meet specific consumer needs. This major combines elements of art, science, and technology to innovate and improve upon existing products or to create entirely new ones.","Industrial Designer, Product Manager, UX/UI Designer, Furniture Designer, Packaging Designer, Design Consultant, Prototype Developer, 3D Modeler","{""IB"":[""IB Design Technology HL"",""IB Visual Arts HL"",""IB Physics SL"",""IB Business Management HL""],""A-Levels"":[""A-Level Design and Technology"",""A-Level Art and Design"",""A-Level Physics"",""A-Level Business Studies""],""AP"":[""AP Studio Art: 3D Design"",""AP Physics 1"",""AP Calculus AB"",""AP Computer Science A""],""MYP"":[""MYP Design"",""MYP Visual Art"",""MYP Sciences"",""MYP Mathematics""],""GCSE"":[""GCSE Design and Technology"",""GCSE Art and Design"",""GCSE Physics"",""GCSE Mathematics""],""CBSE"":[""CBSE Fine Arts"",""CBSE Physics"",""CBSE Mathematics"",""CBSE Business Studies""]}"
436,Design,UX/UI Design,"UX/UI Design is a specialized field that focuses on enhancing user satisfaction and accessibility while interacting with products, primarily digital interfaces. This major combines principles of design, psychology, and technology to create intuitive and aesthetically pleasing digital experiences.","User Experience Designer, User Interface Designer, Interaction Designer, Product Designer, Visual Designer, Usability Analyst, Information Architect, UX Researcher","{""IB"":[""IB Visual Arts HL"",""IB Information Technology in a Global Society HL"",""IB Design Technology HL"",""IB Psychology SL""],""A-Levels"":[""A-Level Art and Design"",""A-Level Graphic Communication"",""A-Level Computer Science"",""A-Level Psychology""],""AP"":[""AP Studio Art: 2-D Design"",""AP Psychology"",""AP Computer Science A""],""MYP"":[""MYP Design"",""MYP Visual Art"",""MYP Digital Design""],""GCSE"":[""GCSE Art and Design"",""GCSE Design and Technology"",""GCSE Computer Science""],""CBSE"":[""CBSE Fine Arts"",""CBSE Information Technology"",""CBSE Psychology""]}"
437,Design,Web Design,"Web Design is a dynamic and creative major focused on the design and maintenance of websites, integrating both technical skills and artistic development. Students learn to create accessible and responsive designs, understand user experience, and manage various web technologies.","Web Designer, User Interface Designer, User Experience Designer, Front-end Developer, Digital Media Specialist, Web Content Manager, SEO Specialist","{""IB"":[""IB Visual Arts"",""IB Computer Science"",""IB Information Technology in a Global Society"",""IB Design Technology""],""A-Levels"":[""A-Level Art and Design"",""A-Level Computer Science"",""A-Level Graphic Communication""],""AP"":[""AP Computer Science A"",""AP Studio Art: 2-D Design"",""AP Art History""],""MYP"":[""MYP Design"",""MYP Visual Art"",""MYP Digital Design""],""GCSE"":[""GCSE Art and Design"",""GCSE Computer Science"",""GCSE Design and Technology""],""CBSE"":[""CBSE Fine Arts"",""CBSE Information Technology"",""CBSE Multimedia and Web Technology""]}"
438,Design,Animation Design,"Animation Design is a major focused on the art and technique of creating images and scenes in motion, often for media such as films, games, and online content. This field combines creative visual storytelling with technical skills in computer graphics and digital tools.","Animator, Visual Effects Artist, Game Designer, Character Designer, Motion Graphics Designer, 3D Modeler, Concept Artist, Digital Painter","{""IB"":[""IB Visual Arts HL"",""IB Film Studies SL"",""IB Computer Science SL"",""IB Design Technology SL""],""A-Levels"":[""A-Level Art and Design"",""A-Level Media Studies"",""A-Level Computer Science"",""A-Level Graphic Communication""],""AP"":[""AP Studio Art: 2-D Design"",""AP Studio Art: 3-D Design"",""AP Computer Science A"",""AP Art History""],""MYP"":[""MYP Visual Art"",""MYP Design"",""MYP Integrated Humanities"",""MYP Digital Design""],""GCSE"":[""GCSE Art and Design"",""GCSE Media Studies"",""GCSE Computer Science"",""GCSE Design and Technology""],""CBSE"":[""CBSE Fine Arts"",""CBSE Graphics"",""CBSE Multimedia and Web Technology"",""CBSE Computer Science""]}"
439,Design,Visual Communication,"Visual Communication is a creative field that focuses on the use of visual elements to convey messages and information effectively across various media platforms. This major integrates principles of design, art, and communication techniques to prepare students for diverse visual and digital media environments.","Graphic designer, Art director, User experience (UX) designer, Web designer, Multimedia artist, Brand identity developer, Visual content specialist, Advertising creative","{""IB"":[""IB Visual Arts HL"",""IB Design Technology HL"",""IB Business Management HL"",""IB Information Technology in a Global Society SL""],""A-Levels"":[""A-Level Art and Design"",""A-Level Graphic Communication"",""A-Level Media Studies"",""A-Level Business Studies""],""AP"":[""AP Studio Art: 2-D Design"",""AP Studio Art: Drawing"",""AP Computer Science A"",""AP Psychology""],""MYP"":[""MYP Design"",""MYP Visual Art"",""MYP Technology"",""MYP Individuals and Societies""],""GCSE"":[""GCSE Art and Design"",""GCSE Design and Technology"",""GCSE Media Studies"",""GCSE Information and Communication Technology""],""CBSE"":[""CBSE Fine Arts"",""CBSE Graphics"",""CBSE Multimedia and Web Technology"",""CBSE Business Studies""]}"
440,Design,Textile Design,"Textile Design is a specialized field focusing on the creation and functional design of various types of fabrics used in fashion, interiors, and industrial applications. The major combines artistic vision with technical skills, including knowledge of fibers, weaves, and the use of digital design tools.","Fashion Designer, Textile Designer, Interior Designer, Product Developer, Color Technologist, Fabric Buyer, Trend Forecaster, Quality Control Specialist","{""IB"":[""IB Visual Arts HL"",""IB Design Technology HL"",""IB Business Management SL""],""A-Levels"":[""A-Level Art and Design"",""A-Level Design and Technology"",""A-Level Business Studies""],""AP"":[""AP Studio Art: 2-D Design"",""AP Art History"",""AP Environmental Science""],""MYP"":[""MYP Design"",""MYP Visual Art""],""GCSE"":[""GCSE Art and Design"",""GCSE Design and Technology"",""GCSE Business Studies""],""CBSE"":[""CBSE Fine Arts"",""CBSE Home Science"",""CBSE Business Studies""]}"
441,Design,Interaction Design,"Interaction Design focuses on creating engaging interfaces with well-thought-out behaviors. Understanding how users interact with technology, students learn to design experiences across different devices and platforms.","User Experience (UX) Designer, User Interface (UI) Designer, Interaction Designer, Product Designer, Usability Analyst, Web Designer, Mobile App Designer, Human-Computer Interaction Researcher","{""IB"":[""IB Visual Arts HL"",""IB Computer Science HL"",""IB Design Technology HL"",""IB Information Technology in a Global Society SL""],""A-Levels"":[""A-Level Design and Technology"",""A-Level Art and Design"",""A-Level Computer Science""],""AP"":[""AP Studio Art: 2-D Design"",""AP Computer Science A"",""AP Psychology""],""MYP"":[""MYP Design"",""MYP Arts""],""GCSE"":[""GCSE Art and Design"",""GCSE Design and Technology"",""GCSE Computer Science""],""CBSE"":[""CBSE Fine Arts"",""CBSE Information Practices"",""CBSE Multimedia and Web Technology""]}"
442,Design,Game Design,"Game Design is a specialized field of study focusing on the creation and development of interactive games, encompassing aspects such as storytelling, graphic design, and programming. Students learn to conceptualize, design, and produce digital and analog gaming experiences, using a range of technologies and creative methodologies.","Game Developer, Level Designer, Game Artist, UI/UX Designer, Sound Designer, Quality Assurance Tester, Game Writer, Game Producer","{""IB"":[""IB Computer Science HL"",""IB Visual Arts HL"",""IB Mathematics AI HL"",""IB Design Technology HL"",""IB Theatre HL""],""A-Levels"":[""A-Level Computer Science"",""A-Level Art and Design"",""A-Level Mathematics"",""A-Level Media Studies"",""A-Level Film Studies""],""AP"":[""AP Computer Science A"",""AP Studio Art: Drawing"",""AP Calculus AB"",""AP Physics C"",""AP Psychology""],""MYP"":[""MYP Design"",""MYP Visual Art"",""MYP Mathematics"",""MYP Technology"",""MYP Digital Design""],""GCSE"":[""GCSE Computer Science"",""GCSE Art and Design"",""GCSE Mathematics"",""GCSE Media Studies"",""GCSE Design and Technology""],""CBSE"":[""CBSE Multimedia and Web Technology"",""CBSE Fine Arts"",""CBSE Mathematics"",""CBSE Informatics Practices"",""CBSE Physics""]}"
443,Design,Design Management,"Design Management is a multidisciplinary field that combines elements of business management, design, and technology to lead and direct the creative process in various industries. This major prepares students to oversee design projects, from conception through implementation, ensuring they meet business objectives and are delivered efficiently.","Design Project Manager, Brand Strategist, Creative Director, User Experience (UX) Designer, Product Development Manager, Marketing Manager, Design Consultant, Innovation Manager","{""IB"":[""IB Visual Arts HL"",""IB Business Management HL"",""IB Design Technology HL"",""IB Economics SL""],""A-Levels"":[""A-Level Art and Design"",""A-Level Business Studies"",""A-Level Graphic Communication"",""A-Level Economics""],""AP"":[""AP Studio Art: 2-D Design"",""AP Studio Art: 3-D Design"",""AP Art History"",""AP Microeconomics""],""MYP"":[""MYP Design"",""MYP Visual Art"",""MYP Individuals and Societies"",""MYP Mathematics""],""GCSE"":[""GCSE Art and Design"",""GCSE Business Studies"",""GCSE Design and Technology"",""GCSE Mathematics""],""CBSE"":[""CBSE Fine Arts"",""CBSE Business Studies"",""CBSE Economics"",""CBSE Mathematics""]}"
444,Design,Jewelry Design,"Jewelry Design is a creative and technical major focusing on the art of designing and creating jewelry. This field combines aesthetics with material science, allowing students to explore various techniques and materials used in the production of wearable art.","Jewelry Designer, Gemologist, Product Developer, Jewelry Store Manager, CAD Jewelry Designer, Precious Stone Setter, Quality Control Specialist, Sales Consultant","{""IB"":[""IB Visual Arts HL"",""IB Design Technology SL"",""IB Business Management SL""],""A-Levels"":[""A-Level Art and Design"",""A-Level Design and Technology"",""A-Level Business Studies""],""AP"":[""AP Studio Art: 2-D Design"",""AP Studio Art: 3-D Design"",""AP Art History""],""MYP"":[""MYP Design"",""MYP Visual Art""],""GCSE"":[""GCSE Art and Design"",""GCSE Design and Technology""],""CBSE"":[""CBSE Fine Arts"",""CBSE Business Studies""]}"
445,Design,Exhibition Design,"Exhibition Design is a specialized field that focuses on the creation of informative and engaging displays in museums, galleries, trade shows, and public exhibitions. It combines elements of interior design, graphic design, and multimedia to create immersive environments that communicate themes and messages effectively.","Exhibition Designer, Museum Curator, Set Designer, Event Coordinator, Visual Merchandiser, Display Artist, Trade Show Manager, Gallery Director","{""IB"":[""IB Visual Arts HL"",""IB Design Technology HL"",""IB History HL"",""IB Business Management HL""],""A-Levels"":[""A-Level Art and Design"",""A-Level Design and Technology"",""A-Level Business Studies"",""A-Level History""],""AP"":[""AP Art History"",""AP Studio Art: 2-D Design"",""AP Studio Art: 3-D Design"",""AP Psychology""],""MYP"":[""MYP Design"",""MYP Visual Art"",""MYP Individuals and Societies"",""MYP Physical and Health Education""],""GCSE"":[""GCSE Art and Design"",""GCSE Design and Technology"",""GCSE Business Studies"",""GCSE History""],""CBSE"":[""CBSE Fine Arts"",""CBSE Business Studies"",""CBSE History"",""CBSE Physical Education""]}"
446,Design,Furniture Design,"Furniture Design is a specialized field focusing on the creation and ideation of furniture pieces, combining elements of art, functionality, and engineering. Students will learn various design techniques, materials science, and ergonomic principles to create innovative and practical furniture solutions.","Furniture Designer, Interior Designer, Product Designer, Industrial Designer, Set Designer for Film and Theater, Design Consultant, CAD Technician, Exhibition Designer","{""IB"":[""IB Visual Arts HL"",""IB Design Technology HL"",""IB Physics SL"",""IB Mathematics SL""],""A-Levels"":[""A-Level Design and Technology"",""A-Level Art and Design"",""A-Level Physics"",""A-Level Mathematics""],""AP"":[""AP Studio Art: 3-D Design"",""AP Physics C"",""AP Calculus AB"",""AP Art History""],""MYP"":[""MYP Design"",""MYP Visual Art"",""MYP Sciences"",""MYP Mathematics""],""GCSE"":[""GCSE Design and Technology"",""GCSE Art and Design"",""GCSE Physics"",""GCSE Mathematics""],""CBSE"":[""CBSE Fine Arts"",""CBSE Physical Education"",""CBSE Physics"",""CBSE Mathematics""]}"
447,Design,Media Design,"Media Design is a dynamic major that combines elements of art, technology, and communication to create visually compelling media for various platforms. Students learn to conceptualize, design, and produce multimedia content that effectively communicates messages in both digital and traditional media.","Graphic Designer, Multimedia Artist, Web Designer, User Experience (UX) Designer, Digital Media Specialist, Art Director, Motion Graphics Designer, Visual Content Developer","{""IB"":[""IB Visual Arts HL"",""IB Information Technology in a Global Society HL"",""IB Film HL"",""IB Design Technology HL""],""A-Levels"":[""A-Level Art and Design"",""A-Level Media Studies"",""A-Level Graphic Communication"",""A-Level Information Technology""],""AP"":[""AP Studio Art: 2-D Design"",""AP Studio Art: 3-D Design"",""AP Computer Science A"",""AP Art History""],""MYP"":[""MYP Design"",""MYP Arts"",""MYP Technology""],""GCSE"":[""GCSE Art and Design"",""GCSE Media Studies"",""GCSE Design and Technology"",""GCSE Computer Science""],""CBSE"":[""CBSE Fine Arts"",""CBSE Graphic Design"",""CBSE Multimedia and Web Technology"",""CBSE Information Technology""]}"
448,Design,Spatial Design,"Spatial Design focuses on the design and organization of three-dimensional space, including aspects of architecture, urban planning, and interior design. This major emphasizes creative and technical solutions to enhance the functionality and aesthetics of spaces for human use and interaction.","Interior Designer, Urban Planner, Landscape Architect, Exhibition Designer, Set Designer for Film and Theater, Environmental Consultant, Spatial Data Analyst","{""IB"":[""IB Visual Arts HL"",""IB Design Technology HL"",""IB Geography HL"",""IB Mathematics SL""],""A-Levels"":[""A-Level Art and Design"",""A-Level Design and Technology"",""A-Level Geography"",""A-Level Mathematics""],""AP"":[""AP Studio Art: 3-D Design"",""AP Human Geography"",""AP Calculus AB"",""AP Environmental Science""],""MYP"":[""MYP Design"",""MYP Visual Art"",""MYP Mathematics"",""MYP Individuals and Societies""],""GCSE"":[""GCSE Art and Design"",""GCSE Design and Technology"",""GCSE Geography"",""GCSE Mathematics""],""CBSE"":[""CBSE Fine Arts"",""CBSE Engineering Graphics"",""CBSE Geography"",""CBSE Mathematics""]}"
