id,interest_area,major,short_description,career_paths,prerequisites
355,Management,Business Administration,"Business Administration with a focus on Management involves the study of organizing, planning, and overseeing business operations to efficiently achieve organizational goals. This major equips students with leadership skills and a thorough understanding of various managerial functions.","Business Consultant, Human Resources Manager, Operations Manager, Marketing Manager, Financial Analyst, Entrepreneur, Project Manager, Sales Manager","{""IB"":[""IB Business Management HL"",""IB Mathematics SL"",""IB Economics HL""],""A-Levels"":[""A-Level Business Studies"",""A-Level Mathematics"",""A-Level Economics""],""AP"":[""AP Microeconomics"",""AP Macroeconomics"",""AP Calculus AB"",""AP Statistics""],""MYP"":[""MYP Individuals and Societies"",""MYP Mathematics""],""GCSE"":[""GCSE Business Studies"",""GCSE Mathematics"",""GCSE Economics""],""CBSE"":[""CBSE Business Studies"",""CBSE Economics"",""CBSE Mathematics""]}"
356,Management,Human Resource Management,"Human Resource Management focuses on the strategic and operational roles of managing people and workplace culture in organizations. It equips students with the skills needed to recruit, manage, and enhance the performance of employees in various types of organizations.","HR Manager, Recruitment Coordinator, Training and Development Officer, Employee Relations Manager, Compensation and Benefits Specialist, Talent Acquisition Specialist, HR Consultant, Labor Relations Specialist","{""IB"":[""IB Business Management HL"",""IB Psychology SL"",""IB Economics HL""],""A-Levels"":[""A-Level Business Studies"",""A-Level Psychology"",""A-Level Economics""],""AP"":[""AP Psychology"",""AP Statistics"",""AP Microeconomics""],""MYP"":[""MYP Individuals and Societies"",""MYP Mathematics""],""GCSE"":[""GCSE Business Studies"",""GCSE Mathematics"",""GCSE Psychology""],""CBSE"":[""CBSE Business Studies"",""CBSE Economics"",""CBSE Psychology""]}"
357,Management,International Business,"International Business is a major that focuses on teaching students how to manage businesses in a global context, dealing with the complexities of cross-border and multicultural environments. It combines elements of economics, finance, cultural studies, and management to prepare students for the challenges of international markets.","Global Marketing Manager, International Trade Compliance Officer, Management Analyst, Supply Chain Manager, Business Development Manager, International Financial Analyst, Import/Export Agent, Economic Development Director","{""IB"":[""IB Business Management HL"",""IB Economics HL"",""IB Mathematics SL or HL"",""IB Language B HL""],""A-Levels"":[""A-Level Business Studies"",""A-Level Economics"",""A-Level Mathematics"",""A-Level Modern Foreign Languages""],""AP"":[""AP Microeconomics"",""AP Macroeconomics"",""AP Calculus AB"",""AP Statistics"",""AP Spanish Language and Culture"",""AP French Language and Culture""],""MYP"":[""MYP Individuals and Societies"",""MYP Mathematics"",""MYP Language Acquisition"",""MYP Design""],""GCSE"":[""GCSE Business Studies"",""GCSE Mathematics"",""GCSE Economics"",""GCSE Modern Foreign Languages""],""CBSE"":[""CBSE Business Studies"",""CBSE Economics"",""CBSE Mathematics"",""CBSE Entrepreneurship"",""CBSE Accountancy""]}"
358,Management,Operations Management,"Operations Management is a college major focused on the efficient and effective development and management of a company's resources to maximize its output. The curriculum typically covers areas such as supply chain management, logistics, quality control, and process optimization.","Operations Manager, Supply Chain Analyst, Quality Assurance Manager, Logistics Coordinator, Production Planner, Inventory Manager, Process Improvement Consultant","{""IB"":[""IB Mathematics HL"",""IB Business Management HL""],""A-Levels"":[""A-Level Mathematics"",""A-Level Business Studies""],""AP"":[""AP Calculus AB"",""AP Statistics"",""AP Microeconomics""],""MYP"":[""MYP Mathematics"",""MYP Design""],""GCSE"":[""GCSE Mathematics"",""GCSE Business Studies""],""CBSE"":[""CBSE Mathematics"",""CBSE Business Studies""]}"
359,Management,Supply Chain Management,"Supply Chain Management is a major that focuses on the efficient management of supply chain processes including procurement, logistics, and distribution to optimize a company's operational efficiency. It integrates aspects of business, systems analysis, and strategic planning to ensure products and services are delivered effectively and efficiently.","Logistics Manager, Supply Chain Analyst, Procurement Manager, Operations Manager, Inventory Control Specialist, Distribution Center Manager, Supply Chain Consultant, Purchasing Manager","{""IB"":[""IB Business Management HL"",""IB Economics HL"",""IB Mathematics SL"",""IB Information Technology in a Global Society SL""],""A-Levels"":[""A-Level Business Studies"",""A-Level Economics"",""A-Level Mathematics"",""A-Level Geography""],""AP"":[""AP Microeconomics"",""AP Macroeconomics"",""AP Statistics"",""AP Calculus AB"",""AP Computer Science A""],""MYP"":[""MYP Design"",""MYP Mathematics"",""MYP Business Management""],""GCSE"":[""GCSE Business Studies"",""GCSE Mathematics"",""GCSE Economics""],""CBSE"":[""CBSE Business Studies"",""CBSE Economics"",""CBSE Mathematics"",""CBSE Informatics Practices""]}"
360,Management,Project Management,"Project Management is a college major focused on the skills and knowledge necessary to plan, execute, and oversee projects to meet specific objectives within a given timeframe. Students learn various methodologies, tools, and soft skills such as leadership, communication, and problem-solving, which are essential in managing projects across any industry.","Project Coordinator, Project Manager, Operations Manager, Quality Assurance Analyst, Supply Chain Analyst, Construction Manager, IT Project Manager, Consultant","{""IB"":[""IB Business Management HL"",""IB Mathematics SL"",""IB Economics HL"",""IB Computer Science SL""],""A-Levels"":[""A-Level Business Studies"",""A-Level Mathematics"",""A-Level Economics"",""A-Level Information Technology""],""AP"":[""AP Calculus AB"",""AP Statistics"",""AP Computer Science A"",""AP Microeconomics""],""MYP"":[""MYP Design"",""MYP Mathematics"",""MYP Individuals and Societies""],""GCSE"":[""GCSE Business Studies"",""GCSE Mathematics"",""GCSE Economics"",""GCSE Information and Communication Technology""],""CBSE"":[""CBSE Business Studies"",""CBSE Mathematics"",""CBSE Economics"",""CBSE Informatics Practices""]}"
361,Management,Retail Management,"Retail Management is a specialized major focusing on the oversight and operation of retail businesses, incorporating principles of business administration, marketing, and consumer behavior. This major equips students with the skills needed to manage retail operations, develop marketing strategies, and enhance customer service.","Retail Manager, Store Manager, Merchandise Planner, Buyer, Visual Merchandiser, Supply Chain Analyst, Sales Manager, E-commerce Manager","{""IB"":[""IB Business Management HL"",""IB Economics HL"",""IB Mathematics SL""],""A-Levels"":[""A-Level Business Studies"",""A-Level Mathematics"",""A-Level Economics""],""AP"":[""AP Microeconomics"",""AP Macroeconomics"",""AP Calculus AB"",""AP Statistics""],""MYP"":[""MYP Business Management"",""MYP Mathematics""],""GCSE"":[""GCSE Business Studies"",""GCSE Mathematics""],""CBSE"":[""CBSE Business Studies"",""CBSE Economics"",""CBSE Mathematics""]}"
362,Management,Logistics Management,"Logistics Management is a specialized area of study focused on the efficient and effective management of the supply chain processes, including the acquisition, storage, and transportation of goods. This major prepares students to oversee and optimize operations critical to the distribution and delivery of products.","Supply Chain Analyst, Logistics Manager, Operations Manager, Procurement Manager, Inventory Control Specialist, Distribution Center Manager, Transportation Coordinator, Supply Chain Consultant","{""IB"":[""IB Business Management HL"",""IB Mathematics SL"",""IB Economics HL""],""A-Levels"":[""A-Level Business Studies"",""A-Level Mathematics"",""A-Level Economics""],""AP"":[""AP Calculus AB"",""AP Statistics"",""AP Microeconomics"",""AP Macroeconomics""],""MYP"":[""MYP Design"",""MYP Mathematics""],""GCSE"":[""GCSE Business Studies"",""GCSE Mathematics""],""CBSE"":[""CBSE Business Studies"",""CBSE Mathematics"",""CBSE Economics""]}"
363,Management,Organizational Leadership,"Organizational Leadership is a major focused on developing skills necessary to lead, manage, and inspire teams in a variety of organizational settings. It combines elements of psychology, management, and communication to equip students with the strategic insights needed to guide companies and institutions effectively.","Human Resources Manager, Corporate Trainer, Management Consultant, Nonprofit Director, Organizational Development Specialist, Project Manager, Entrepreneur, Operations Manager","{""IB"":[""IB Business Management HL"",""IB Psychology SL"",""IB Economics HL"",""IB Mathematics SL""],""A-Levels"":[""A-Level Business Studies"",""A-Level Psychology"",""A-Level Economics"",""A-Level Mathematics""],""AP"":[""AP Psychology"",""AP Statistics"",""AP Microeconomics"",""AP Macroeconomics""],""MYP"":[""MYP Individuals and Societies"",""MYP Design"",""MYP Mathematics""],""GCSE"":[""GCSE Business Studies"",""GCSE Mathematics"",""GCSE Psychology""],""CBSE"":[""CBSE Business Studies"",""CBSE Economics"",""CBSE Mathematics"",""CBSE Psychology""]}"
364,Management,Public Administration,"Public Administration is a field of study that focuses on the implementation of government policy, management of public programs, and the preparation of individuals for public service. It combines elements of organizational management, policy analysis, and public affairs to equip graduates with the skills necessary to serve in various governmental and non-governmental roles.","City Manager, Policy Analyst, Public Affairs Consultant, Human Resources Manager, Nonprofit Organization Director, Government Relations Officer, Urban Planner, Health Services Administrator","{""IB"":[""IB History HL"",""IB Economics HL"",""IB Business Management HL"",""IB Social and Cultural Anthropology HL""],""A-Levels"":[""A-Level Politics"",""A-Level Business Studies"",""A-Level Economics"",""A-Level Sociology""],""AP"":[""AP U.S. Government and Politics"",""AP Comparative Government and Politics"",""AP Human Geography"",""AP Macroeconomics"",""AP Microeconomics""],""MYP"":[""MYP Individuals and Societies"",""MYP Integrated Humanities"",""MYP Design""],""GCSE"":[""GCSE Business Studies"",""GCSE History"",""GCSE Sociology"",""GCSE Economics""],""CBSE"":[""CBSE Political Science"",""CBSE Economics"",""CBSE Business Studies"",""CBSE Accountancy""]}"
365,Management,Business Analytics,"Business Analytics is a major that combines data science, statistics, and business knowledge to provide insights that help make strategic decisions. Students learn to interpret complex data, predict trends, and improve business processes.","Data Analyst, Business Intelligence Analyst, Market Research Analyst, Operations Analyst, Financial Analyst, Management Consultant, Supply Chain Analyst, Project Manager","{""IB"":[""IB Mathematics HL"",""IB Business Management HL"",""IB Computer Science HL"",""IB Economics HL""],""A-Levels"":[""A-Level Mathematics"",""A-Level Further Mathematics"",""A-Level Economics"",""A-Level Business Studies"",""A-Level Computer Science""],""AP"":[""AP Calculus AB"",""AP Calculus BC"",""AP Statistics"",""AP Computer Science A"",""AP Microeconomics"",""AP Macroeconomics""],""MYP"":[""MYP Mathematics Extended"",""MYP Design Technology"",""MYP Business and Management""],""GCSE"":[""GCSE Mathematics"",""GCSE Business Studies"",""GCSE Economics"",""GCSE Computer Science""],""CBSE"":[""CBSE Mathematics"",""CBSE Business Studies"",""CBSE Economics"",""CBSE Informatics Practices""]}"
366,Management,Healthcare Management,"Healthcare Management is a specialized field of study that focuses on the organization, management, and administration of healthcare systems, hospitals, and other healthcare facilities. This major prepares students to handle the business aspects of medical services, ensuring efficient delivery of healthcare services.","Healthcare Administrator, Hospital CEO, Health Services Manager, Clinical Manager, Health Information Manager, Policy Analyst, Consultant in Healthcare Management, Nursing Home Administrator","{""IB"":[""IB Biology HL"",""IB Business Management HL"",""IB Mathematics SL""],""A-Levels"":[""A-Level Biology"",""A-Level Business Studies"",""A-Level Mathematics""],""AP"":[""AP Biology"",""AP Calculus AB"",""AP Statistics"",""AP Psychology""],""MYP"":[""MYP Sciences"",""MYP Mathematics"",""MYP Individuals and Societies""],""GCSE"":[""GCSE Biology"",""GCSE Mathematics"",""GCSE Business Studies""],""CBSE"":[""CBSE Biology"",""CBSE Business Studies"",""CBSE Mathematics""]}"
367,Management,Entrepreneurship,"The Entrepreneurship major focuses on equipping students with the skills and knowledge to start, manage, and grow their own businesses, as well as innovate within existing companies. This program emphasizes practical experience, business planning, strategic decision-making, and understanding market dynamics.","Business Owner, Startup Founder, Business Consultant, Venture Capital Analyst, Product Manager, Marketing Manager, Business Development Officer, Corporate Innovator","{""IB"":[""IB Business Management HL"",""IB Economics HL"",""IB Mathematics SL"",""IB Information Technology in a Global Society SL""],""A-Levels"":[""A-Level Business Studies"",""A-Level Economics"",""A-Level Mathematics"",""A-Level Further Mathematics""],""AP"":[""AP Microeconomics"",""AP Macroeconomics"",""AP Calculus AB"",""AP Statistics"",""AP Computer Science A""],""MYP"":[""MYP Design"",""MYP Individuals and Societies"",""MYP Mathematics"",""MYP Business Management""],""GCSE"":[""GCSE Business Studies"",""GCSE Mathematics"",""GCSE Economics"",""GCSE Information and Communication Technology""],""CBSE"":[""CBSE Business Studies"",""CBSE Economics"",""CBSE Mathematics"",""CBSE Informatics Practices""]}"
368,Management,Industrial Management,"Industrial Management is a specialized field of study that focuses on the optimization of complex processes or systems within an industrial setting, integrating engineering and management principles. It prepares students to improve efficiency, productivity, and managerial processes in industries such as manufacturing, technology, and logistics.","Operations Manager, Supply Chain Analyst, Quality Control Manager, Project Manager, Industrial Production Manager, Business Consultant, Facilities Manager, Lean Coordinator","{""IB"":[""IB Business Management HL"",""IB Mathematics HL"",""IB Physics SL""],""A-Levels"":[""A-Level Mathematics"",""A-Level Business Studies"",""A-Level Physics""],""AP"":[""AP Calculus AB"",""AP Statistics"",""AP Physics 1"",""AP Microeconomics""],""MYP"":[""MYP Design"",""MYP Mathematics"",""MYP Physical and Earth Sciences""],""GCSE"":[""GCSE Mathematics"",""GCSE Business Studies"",""GCSE Physics""],""CBSE"":[""CBSE Business Studies"",""CBSE Mathematics"",""CBSE Physics""]}"
369,Management,E-commerce,"The E-commerce major focuses on the principles and technologies for conducting business over the internet. It combines aspects of business management, information technology, and digital marketing to prepare students for the evolving online marketplace.","E-commerce Manager, Digital Marketing Specialist, Business Analyst, Web Developer, Supply Chain Manager, Data Analyst, SEO Specialist, Product Manager","{""IB"":[""IB Business Management HL"",""IB Information Technology in a Global Society HL"",""IB Mathematics AI SL"",""IB Economics SL""],""A-Levels"":[""A-Level Business Studies"",""A-Level Computer Science"",""A-Level Mathematics"",""A-Level Economics""],""AP"":[""AP Computer Science A"",""AP Calculus AB"",""AP Microeconomics"",""AP Statistics""],""MYP"":[""MYP Design"",""MYP Mathematics"",""MYP Business and Management""],""GCSE"":[""GCSE Business Studies"",""GCSE Mathematics"",""GCSE Information and Communication Technology""],""CBSE"":[""CBSE Business Studies"",""CBSE Information Technology"",""CBSE Mathematics"",""CBSE Economics""]}"
370,Management,Strategic Management,"Strategic Management is a college major that focuses on the development of skills necessary for students to understand, analyze, and implement strategies within business and organizational contexts. It covers areas such as competitive strategy, corporate governance, and operational strategy, equipping students to become effective leaders and decision-makers in various business environments.","Management Consultant, Business Strategist, Corporate Development Officer, Strategic Planner, Operations Manager, Entrepreneur, Business Analyst, Project Manager","{""IB"":[""IB Business Management HL"",""IB Economics HL"",""IB Mathematics SL"",""IB Mathematics HL""],""A-Levels"":[""A-Level Business Studies"",""A-Level Economics"",""A-Level Mathematics"",""A-Level Further Mathematics""],""AP"":[""AP Microeconomics"",""AP Macroeconomics"",""AP Calculus AB"",""AP Statistics""],""MYP"":[""MYP Design"",""MYP Mathematics"",""MYP Individuals and Societies""],""GCSE"":[""GCSE Business Studies"",""GCSE Mathematics"",""GCSE Economics""],""CBSE"":[""CBSE Business Studies"",""CBSE Economics"",""CBSE Mathematics"",""CBSE Accountancy""]}"
371,Management,Sustainability Management,"Sustainability Management is a multidisciplinary major that combines principles of environmental science, economics, and business management to address and solve sustainability issues related to natural resources and environmental conservation. The program equips students with the skills needed to develop sustainable business practices and contribute to global sustainability efforts.","Sustainability Consultant, Environmental Policy Maker, Corporate Sustainability Officer, Renewable Energy Manager, Waste Management Director, Green Building Coordinator, Environmental Auditor, Corporate Social Responsibility Manager","{""IB"":[""IB Environmental Systems and Societies SL"",""IB Business Management HL"",""IB Economics HL"",""IB Geography HL"",""IB Biology HL""],""A-Levels"":[""A-Level Geography"",""A-Level Business Studies"",""A-Level Environmental Science"",""A-Level Economics""],""AP"":[""AP Environmental Science"",""AP Human Geography"",""AP Statistics"",""AP Economics""],""MYP"":[""MYP Design"",""MYP Sciences"",""MYP Mathematics"",""MYP Individuals and Societies""],""GCSE"":[""GCSE Geography"",""GCSE Business Studies"",""GCSE Mathematics"",""GCSE Science""],""CBSE"":[""CBSE Business Studies"",""CBSE Economics"",""CBSE Geography"",""CBSE Biology""]}"
372,Management,Nonprofit Management,"The major in Nonprofit Management focuses on equipping students with the necessary skills and knowledge to effectively manage and lead nonprofit organizations. Students learn about fundraising, grant writing, volunteer management, and strategic planning specific to the nonprofit sector.","Nonprofit Executive Director, Program Director, Fundraising Manager, Grant Writer, Volunteer Coordinator, Social Media Manager, Community Outreach Coordinator, Policy Analyst","{""IB"":[""IB Business Management HL"",""IB Economics HL"",""IB Social and Cultural Anthropology SL"",""IB Global Politics HL""],""A-Levels"":[""A-Level Business Studies"",""A-Level Sociology"",""A-Level Economics"",""A-Level Mathematics""],""AP"":[""AP Macroeconomics"",""AP Microeconomics"",""AP Statistics"",""AP Psychology""],""MYP"":[""MYP Individuals and Societies"",""MYP Mathematics"",""MYP Design""],""GCSE"":[""GCSE Business Studies"",""GCSE Mathematics"",""GCSE Sociology""],""CBSE"":[""CBSE Business Studies"",""CBSE Economics"",""CBSE Mathematics"",""CBSE Accountancy""]}"
373,Management,Real Estate Management,"Real Estate Management is a college major that focuses on the principles and practices involved in the management, operation, marketing, and financing of real estate properties. The program equips students with skills in property development, asset management, and investment analysis.","Real Estate Broker, Property Manager, Real Estate Appraiser, Commercial Leasing Manager, Real Estate Investment Consultant, Facility Manager, Urban Planner, Real Estate Attorney","{""IB"":[""IB Business Management HL"",""IB Economics HL"",""IB Mathematics SL"",""IB Geography SL""],""A-Levels"":[""A-Level Business Studies"",""A-Level Mathematics"",""A-Level Economics"",""A-Level Geography""],""AP"":[""AP Calculus AB"",""AP Statistics"",""AP Microeconomics"",""AP Macroeconomics""],""MYP"":[""MYP Mathematics"",""MYP Individuals and Societies"",""MYP Design""],""GCSE"":[""GCSE Mathematics"",""GCSE Business Studies"",""GCSE Geography"",""GCSE Economics""],""CBSE"":[""CBSE Business Studies"",""CBSE Mathematics"",""CBSE Economics"",""CBSE Accountancy""]}"
374,Management,Business Law,"Business Law is a specialized major focusing on the intersection of business practices and legal regulations. It equips students with the understanding of corporate law, commercial transactions, and legal implications affecting business decisions.","Corporate Lawyer, Legal Consultant, Compliance Officer, Contract Manager, Business Advisor, Human Resources Manager, Intellectual Property Rights Manager","{""IB"":[""IB Business Management HL"",""IB Economics HL"",""IB Mathematics SL"",""IB English A: Language and Literature HL""],""A-Levels"":[""A-Level Business Studies"",""A-Level Law"",""A-Level Economics"",""A-Level Mathematics""],""AP"":[""AP Macroeconomics"",""AP Microeconomics"",""AP Calculus AB"",""AP English Language and Composition""],""MYP"":[""MYP Individuals and Societies"",""MYP Mathematics"",""MYP Language and Literature""],""GCSE"":[""GCSE Business Studies"",""GCSE Law"",""GCSE English Language"",""GCSE Mathematics""],""CBSE"":[""CBSE Business Studies"",""CBSE Economics"",""CBSE Legal Studies"",""CBSE English"",""CBSE Mathematics""]}"
375,Engineering,Mechanical Engineering,"Mechanical Engineering is a diverse field of study that focuses on the design, analysis, manufacturing, and maintenance of mechanical systems. It integrates principles of engineering physics and mathematics to develop solutions to real-world problems.","Mechanical Engineer, Aerospace Engineer, Automotive Engineer, Robotics Engineer, Project Manager, Energy Systems Engineer, HVAC Engineer, Product Design Engineer","{""IB"":[""IB Mathematics HL"",""IB Physics HL"",""IB Design Technology SL""],""A-Levels"":[""A-Level Mathematics"",""A-Level Physics"",""A-Level Further Mathematics""],""AP"":[""AP Calculus BC"",""AP Physics C: Mechanics"",""AP Physics C: Electricity and Magnetism""],""MYP"":[""MYP Design"",""MYP Physical and Earth Sciences"",""MYP Mathematics""],""GCSE"":[""GCSE Mathematics"",""GCSE Physics"",""GCSE Design and Technology""],""CBSE"":[""CBSE Physics"",""CBSE Mathematics"",""CBSE Chemistry""]}"
376,Engineering,Electrical Engineering,"Electrical Engineering is a field of engineering that primarily deals with the study and application of electricity, electronics, and electromagnetism. This major equips students with the skills to design, develop, and manage electrical systems and components used in a wide range of industries.","Electrical Engineer, Systems Engineer, Control Engineer, Power Engineer, Telecommunications Engineer, Instrumentation Engineer, Project Manager, Research and Development Engineer","{""IB"":[""IB Mathematics HL"",""IB Physics HL"",""IB Computer Science SL""],""A-Levels"":[""A-Level Mathematics"",""A-Level Further Mathematics"",""A-Level Physics""],""AP"":[""AP Calculus BC"",""AP Physics C: Electricity and Magnetism"",""AP Computer Science A""],""MYP"":[""MYP Mathematics"",""MYP Design"",""MYP Sciences""],""GCSE"":[""GCSE Mathematics"",""GCSE Physics"",""GCSE Design and Technology""],""CBSE"":[""CBSE Physics"",""CBSE Mathematics"",""CBSE Informatics Practices""]}"
377,Engineering,Civil Engineering,"Civil Engineering is a discipline that involves the design, construction, and maintenance of the physical and naturally built environment, including works like roads, bridges, canals, dams, and buildings. This major combines expertise in mathematics, science, and technology to solve real-world problems and improve infrastructure.","Structural Engineer, Transportation Engineer, Geotechnical Engineer, Water Resources Engineer, Environmental Engineer, Construction Manager, Urban Planner, Project Engineer","{""IB"":[""IB Mathematics HL"",""IB Physics HL"",""IB Design Technology SL"",""IB Environmental Systems and Societies SL""],""A-Levels"":[""A-Level Mathematics"",""A-Level Physics"",""A-Level Further Mathematics"",""A-Level Geography""],""AP"":[""AP Calculus AB"",""AP Calculus BC"",""AP Physics C: Mechanics"",""AP Physics C: Electricity and Magnetism"",""AP Environmental Science""],""MYP"":[""MYP Mathematics Extended"",""MYP Design"",""MYP Physical and Earth Sciences""],""GCSE"":[""GCSE Mathematics"",""GCSE Physics"",""GCSE Geography"",""GCSE Design and Technology""],""CBSE"":[""CBSE Physics"",""CBSE Mathematics"",""CBSE Chemistry"",""CBSE Engineering Graphics""]}"
