id,interest_area,major,short_description,career_paths,prerequisites
378,Engineering,Chemical Engineering,"Chemical Engineering is the application of chemical, physical, and biological sciences along with mathematics and economics to efficiently use, produce, design, transport, and transform energy and materials. This major prepares students for critical roles in industries ranging from energy to pharmaceuticals, enhancing operational efficiencies and developing sustainable processes.","Process Engineer, Safety Engineer, Energy Manager, Biotechnologist, Environmental Engineer, Quality Control Engineer, Petrochemical Engineer, Research Scientist","{""IB"":[""IB Chemistry HL"",""IB Mathematics HL"",""IB Physics SL"",""IB Biology SL""],""A-Levels"":[""A-Level Chemistry"",""A-Level Mathematics"",""A-Level Physics"",""A-Level Further Mathematics""],""AP"":[""AP Chemistry"",""AP Calculus BC"",""AP Physics C: Mechanics"",""AP Biology""],""MYP"":[""MYP Sciences"",""MYP Mathematics""],""GCSE"":[""GCSE Chemistry"",""GCSE Mathematics"",""GCSE Physics"",""GCSE Biology""],""CBSE"":[""CBSE Chemistry"",""CBSE Mathematics"",""CBSE Physics"",""CBSE Biology""]}"
379,Engineering,Computer Engineering,"Computer Engineering integrates principles from both electrical engineering and computer science to develop hardware and software solutions. This major focuses on the design, implementation, and management of information systems and hardware processes critical in various tech-driven fields.","Software Engineer, Hardware Engineer, Systems Analyst, Network Architect, Embedded Systems Engineer, Data Scientist, Robotics Engineer","{""IB"":[""IB Mathematics HL"",""IB Physics HL"",""IB Computer Science HL""],""A-Levels"":[""A-Level Mathematics"",""A-Level Further Mathematics"",""A-Level Physics""],""AP"":[""AP Calculus BC"",""AP Physics C: Electricity and Magnetism"",""AP Computer Science A""],""MYP"":[""MYP Extended Mathematics"",""MYP Design"",""MYP Physical and Earth Sciences""],""GCSE"":[""GCSE Mathematics"",""GCSE Physics"",""GCSE Computer Science""],""CBSE"":[""CBSE Physics"",""CBSE Mathematics"",""CBSE Computer Science""]}"
380,Engineering,Aerospace Engineering,"Aerospace Engineering is a dynamic field that focuses on the design, development, and testing of aircraft and spacecraft. It combines elements of mechanical, electrical, and materials engineering to solve complex problems related to systems that operate within the Earth's atmosphere and beyond.","Aerospace Engineer, Flight Systems Test Engineer, Satellite Systems Engineer, Aircraft Designer, Propulsion Engineer, Avionics Engineer, Spacecraft Operations Director, Defense Systems Analyst","{""IB"":[""IB Mathematics HL"",""IB Physics HL"",""IB Chemistry SL"",""IB Design Technology HL""],""A-Levels"":[""A-Level Mathematics"",""A-Level Physics"",""A-Level Further Mathematics"",""A-Level Chemistry""],""AP"":[""AP Calculus BC"",""AP Physics C: Mechanics"",""AP Physics C: Electricity and Magnetism"",""AP Chemistry""],""MYP"":[""MYP Design"",""MYP Physical and Earth Sciences"",""MYP Mathematics"",""MYP Technology""],""GCSE"":[""GCSE Mathematics"",""GCSE Physics"",""GCSE Chemistry"",""GCSE Design and Technology""],""CBSE"":[""CBSE Physics"",""CBSE Mathematics"",""CBSE Chemistry"",""CBSE Engineering Graphics""]}"
381,Engineering,Biomedical Engineering,"Biomedical Engineering is an interdisciplinary field that combines principles from engineering and the biological sciences to develop technologies and systems aimed at improving healthcare. This major focuses on the design and development of devices, software, and systems for medical applications.","Biomedical engineer, Clinical engineer, Medical technology developer, Research scientist, Quality assurance/Regulatory affairs specialist, Healthcare consultant, Technical sales engineer, Biomechanics engineer","{""IB"":[""IB Mathematics HL"",""IB Biology HL"",""IB Physics HL"",""IB Chemistry SL""],""A-Levels"":[""A-Level Mathematics"",""A-Level Biology"",""A-Level Physics"",""A-Level Chemistry""],""AP"":[""AP Calculus BC"",""AP Biology"",""AP Chemistry"",""AP Physics C: Mechanics""],""MYP"":[""MYP Sciences"",""MYP Mathematics""],""GCSE"":[""GCSE Mathematics"",""GCSE Biology"",""GCSE Chemistry"",""GCSE Physics""],""CBSE"":[""CBSE Physics"",""CBSE Chemistry"",""CBSE Biology"",""CBSE Mathematics""]}"
382,Engineering,Environmental Engineering,"Environmental Engineering focuses on developing solutions to environmental problems and improving the health of the natural world. This major combines principles from biology, chemistry, physics, and mathematics to address issues such as water and air pollution, waste management, and sustainable design.","Environmental Consultant, Water Project Manager, Air Quality Inspector, Waste Management Engineer, Sustainability Specialist, Environmental Health and Safety Director, Public Health Engineer, Renewable Energy Engineer","{""IB"":[""IB Mathematics HL"",""IB Chemistry HL"",""IB Biology SL"",""IB Environmental Systems and Societies SL"",""IB Physics HL""],""A-Levels"":[""A-Level Mathematics"",""A-Level Chemistry"",""A-Level Biology"",""A-Level Physics"",""A-Level Environmental Science""],""AP"":[""AP Calculus AB"",""AP Environmental Science"",""AP Chemistry"",""AP Biology"",""AP Physics C: Mechanics""],""MYP"":[""MYP Sciences"",""MYP Mathematics"",""MYP Design"",""MYP Physical and Health Education""],""GCSE"":[""GCSE Mathematics"",""GCSE Chemistry"",""GCSE Biology"",""GCSE Physics""],""CBSE"":[""CBSE Physics"",""CBSE Chemistry"",""CBSE Biology"",""CBSE Mathematics""]}"
383,Engineering,Industrial Engineering,"Industrial Engineering focuses on optimizing complex processes, systems, or organizations by developing, improving, and implementing integrated systems of people, money, knowledge, information, equipment, energy, and materials. This major combines principles and techniques used in engineering, mathematics, and social sciences to achieve these goals.","Operations Manager, Quality Assurance Engineer, Systems Analyst, Production Planner, Supply Chain Analyst, Process Engineer, Project Manager, Human Factors Engineer","{""IB"":[""IB Mathematics HL"",""IB Physics HL"",""IB Design Technology SL"",""IB Business Management HL""],""A-Levels"":[""A-Level Mathematics"",""A-Level Physics"",""A-Level Further Mathematics"",""A-Level Economics""],""AP"":[""AP Calculus BC"",""AP Statistics"",""AP Physics C: Mechanics"",""AP Computer Science A""],""MYP"":[""MYP Design"",""MYP Mathematics"",""MYP Sciences""],""GCSE"":[""GCSE Mathematics"",""GCSE Physics"",""GCSE Design and Technology"",""GCSE Business Studies""],""CBSE"":[""CBSE Physics"",""CBSE Mathematics"",""CBSE Chemistry"",""CBSE Economics""]}"
384,Engineering,Robotics Engineering,"Robotics Engineering is a field of engineering that combines electronic, mechanical, and software engineering to design, construct, operate, and use robots. This major equips students with the skills to create automated systems and the software interfaces that control them.","Robotics Engineer, Automation Engineer, Software Developer for Robotics, Systems Designer, Research Scientist, Robotics Technician, Artificial Intelligence Specialist, Aerospace Robotics Engineer","{""IB"":[""IB Mathematics HL"",""IB Physics HL"",""IB Computer Science HL"",""IB Design Technology HL""],""A-Levels"":[""A-Level Mathematics"",""A-Level Further Mathematics"",""A-Level Physics"",""A-Level Computer Science""],""AP"":[""AP Calculus BC"",""AP Physics C: Mechanics"",""AP Computer Science A"",""AP Statistics""],""MYP"":[""MYP Design"",""MYP Mathematics"",""MYP Sciences""],""GCSE"":[""GCSE Mathematics"",""GCSE Physics"",""GCSE Computer Science"",""GCSE Design and Technology""],""CBSE"":[""CBSE Physics"",""CBSE Mathematics"",""CBSE Informatics Practices"",""CBSE Engineering Graphics""]}"
385,Engineering,Nuclear Engineering,"Nuclear Engineering focuses on the processes, research, and systems surrounding the production and use of nuclear energy and radiation. This field combines principles from physics, chemistry, and engineering to develop solutions in power generation, medical technology, and national security.","Nuclear Engineer, Reactor Operator, Radiation Engineer, Health Physics Technician, Nuclear Power Plant Manager, Nuclear Safety Engineer, Radiological Scientist, Energy Policy Analyst","{""IB"":[""IB Physics HL"",""IB Mathematics HL"",""IB Chemistry HL""],""A-Levels"":[""A-Level Physics"",""A-Level Mathematics"",""A-Level Further Mathematics"",""A-Level Chemistry""],""AP"":[""AP Physics C: Mechanics"",""AP Physics C: Electricity and Magnetism"",""AP Calculus BC"",""AP Chemistry""],""MYP"":[""MYP Physical and Earth Sciences"",""MYP Mathematics""],""GCSE"":[""GCSE Physics"",""GCSE Mathematics"",""GCSE Chemistry""],""CBSE"":[""CBSE Physics"",""CBSE Mathematics"",""CBSE Chemistry""]}"
386,Engineering,Systems Engineering,"Systems Engineering is a multidisciplinary field that focuses on designing, integrating, and managing complex systems over their life cycles. This major equips students with the skills to optimize system performance and project outcomes through systematic techniques and methodologies.","Systems Analyst, Systems Engineer, Project Manager, Quality Assurance Engineer, Operations Research Analyst, Industrial Engineer, Process Engineer, Technical Consultant","{""IB"":[""IB Mathematics HL"",""IB Physics HL"",""IB Computer Science HL""],""A-Levels"":[""A-Level Mathematics"",""A-Level Further Mathematics"",""A-Level Physics""],""AP"":[""AP Calculus BC"",""AP Physics C: Mechanics"",""AP Computer Science A""],""MYP"":[""MYP Mathematics"",""MYP Design"",""MYP Sciences""],""GCSE"":[""GCSE Mathematics"",""GCSE Physics"",""GCSE Computer Science""],""CBSE"":[""CBSE Mathematics"",""CBSE Physics"",""CBSE Informatics Practices""]}"
387,Engineering,Mechatronics Engineering,"Mechatronics Engineering is a multidisciplinary field that combines mechanical engineering, electronics, computer engineering, control engineering, and systems design engineering to create useful products and processes. This major focuses on the integration of mechanical components with electronic systems, and the development of smart machines and robotics.","Automation engineer, Robotics engineer, Control system engineer, Instrumentation engineer, Systems designer, Product development engineer, Software engineer, Research and development engineer","{""IB"":[""IB Mathematics HL"",""IB Physics HL"",""IB Design Technology HL"",""IB Computer Science HL""],""A-Levels"":[""A-Level Mathematics"",""A-Level Further Mathematics"",""A-Level Physics"",""A-Level Design and Technology""],""AP"":[""AP Calculus BC"",""AP Physics C: Mechanics"",""AP Physics C: Electricity and Magnetism"",""AP Computer Science A""],""MYP"":[""MYP Design"",""MYP Sciences"",""MYP Mathematics"",""MYP Technology""],""GCSE"":[""GCSE Mathematics"",""GCSE Physics"",""GCSE Design and Technology"",""GCSE Computer Science""],""CBSE"":[""CBSE Physics"",""CBSE Mathematics"",""CBSE Informatics Practices"",""CBSE Engineering Graphics""]}"
388,Engineering,Materials Engineering,"Materials Engineering is a specialized field of engineering that focuses on the discovery, design, and manipulation of materials to create new products and solve engineering problems. It integrates principles of applied physics and chemistry to understand the structure and properties of materials from the atomic to the macroscopic scale.","Materials scientist, Process engineer, Quality control engineer, Research and development engineer, Metallurgical engineer, Polymer engineer, Composite materials engineer, Ceramic engineer","{""IB"":[""IB Chemistry HL"",""IB Physics HL"",""IB Mathematics HL"",""IB Design Technology SL""],""A-Levels"":[""A-Level Chemistry"",""A-Level Physics"",""A-Level Mathematics"",""A-Level Further Mathematics""],""AP"":[""AP Chemistry"",""AP Physics C: Mechanics"",""AP Calculus BC"",""AP Environmental Science""],""MYP"":[""MYP Design"",""MYP Sciences"",""MYP Mathematics""],""GCSE"":[""GCSE Chemistry"",""GCSE Physics"",""GCSE Mathematics"",""GCSE Design and Technology""],""CBSE"":[""CBSE Chemistry"",""CBSE Physics"",""CBSE Mathematics"",""CBSE Engineering Graphics""]}"
389,Engineering,Automotive Engineering,"Automotive Engineering is a specialized branch of engineering focusing on the design, development, and manufacturing of vehicles. This major integrates elements of mechanical, electrical, electronic, software, and safety engineering as applied to the design and production of motorcycles, automobiles, buses, and trucks and their respective engineering subsystems.","Automotive Design Engineer, Performance Engineer, Vehicle Dynamics Controller, Automotive Quality Assurance Manager, Automotive Sales Engineer, Powertrain Engineer, Research and Development Engineer, Automotive Safety Analyst","{""IB"":[""IB Mathematics HL"",""IB Physics HL"",""IB Design Technology SL"",""IB Computer Science SL""],""A-Levels"":[""A-Level Mathematics"",""A-Level Physics"",""A-Level Further Mathematics"",""A-Level Design and Technology""],""AP"":[""AP Calculus AB"",""AP Physics C: Mechanics"",""AP Computer Science A"",""AP Statistics""],""MYP"":[""MYP Design"",""MYP Mathematics"",""MYP Physical and Health Education"",""MYP Sciences""],""GCSE"":[""GCSE Mathematics"",""GCSE Physics"",""GCSE Design and Technology"",""GCSE Computer Science""],""CBSE"":[""CBSE Physics"",""CBSE Mathematics"",""CBSE Chemistry"",""CBSE Information Technology""]}"
390,Engineering,Structural Engineering,"Structural Engineering is a specialized branch of civil engineering that focuses on the design, construction, and maintenance of structures such as buildings, bridges, tunnels, and other large installations. This major combines principles of physics, mathematics, and material science to ensure safety, sustainability, and resilience in infrastructure.","Structural Engineer, Construction Project Manager, Earthquake Engineer, Bridge Engineer, Building Inspector, Civil Engineering Consultant, Forensic Engineer, Structural Design Technician","{""IB"":[""IB Mathematics HL"",""IB Physics HL"",""IB Design Technology SL""],""A-Levels"":[""A-Level Mathematics"",""A-Level Physics"",""A-Level Further Mathematics""],""AP"":[""AP Calculus BC"",""AP Physics C: Mechanics"",""AP Statistics""],""MYP"":[""MYP Mathematics"",""MYP Design"",""MYP Physical and Earth Sciences""],""GCSE"":[""GCSE Mathematics"",""GCSE Physics"",""GCSE Design and Technology""],""CBSE"":[""CBSE Physics"",""CBSE Mathematics"",""CBSE Physical Education""]}"
391,Engineering,Petroleum Engineering,"Petroleum Engineering is a field of engineering focused on the exploration, extraction, and production of oil and natural gas. This major equips students with specialized knowledge in geology, fluid mechanics, and thermodynamics to efficiently utilize and manage natural energy resources.","Reservoir Engineer, Drilling Engineer, Production Engineer, Petrophysical Engineer, Completion Engineer, Field Engineer, Project Manager, Research Scientist","{""IB"":[""IB Mathematics HL"",""IB Physics HL"",""IB Chemistry SL""],""A-Levels"":[""A-Level Mathematics"",""A-Level Physics"",""A-Level Chemistry""],""AP"":[""AP Calculus BC"",""AP Physics C: Mechanics"",""AP Chemistry""],""MYP"":[""MYP Mathematics"",""MYP Design"",""MYP Physical and Earth Sciences""],""GCSE"":[""GCSE Mathematics"",""GCSE Physics"",""GCSE Chemistry""],""CBSE"":[""CBSE Mathematics"",""CBSE Physics"",""CBSE Chemistry""]}"
392,Engineering,Agricultural Engineering,"Agricultural Engineering combines the disciplines of mechanical, civil, electrical, and chemical engineering principles with a knowledge of agricultural principles according to technological principles. A degree in Agricultural Engineering offers a blend of deep understanding in technology and biology, equipping students to improve agricultural productivity and processes.","Agricultural Engineer, Farm Manager, Environmental Controls Engineer, Bioresource Engineer, Agricultural Equipment Designer, Precision Agriculture Technologist, Water Resources Engineer, Rural Development Officer","{""IB"":[""IB Mathematics HL"",""IB Biology HL"",""IB Chemistry SL"",""IB Environmental Systems and Societies SL"",""IB Physics HL""],""A-Levels"":[""A-Level Mathematics"",""A-Level Biology"",""A-Level Chemistry"",""A-Level Physics"",""A-Level Environmental Science""],""AP"":[""AP Calculus AB"",""AP Biology"",""AP Chemistry"",""AP Environmental Science"",""AP Physics C: Mechanics""],""MYP"":[""MYP Sciences"",""MYP Mathematics"",""MYP Design"",""MYP Physical and Health Education""],""GCSE"":[""GCSE Mathematics"",""GCSE Biology"",""GCSE Chemistry"",""GCSE Physics"",""GCSE Design and Technology""],""CBSE"":[""CBSE Physics"",""CBSE Chemistry"",""CBSE Biology"",""CBSE Mathematics"",""CBSE Environmental Science""]}"
393,Engineering,Mining Engineering,"Mining Engineering is a field of engineering focused on the extraction and processing of minerals from the Earth. It involves the study of methods to locate, extract, and process natural resources safely and sustainably.","Mining Engineer, Geological Engineer, Mine Safety Manager, Mineral Processing Engineer, Mine Supervisor, Exploration Geologist, Environmental Compliance Coordinator, Quarry Manager","{""IB"":[""IB Mathematics HL"",""IB Physics HL"",""IB Chemistry SL""],""A-Levels"":[""A-Level Mathematics"",""A-Level Physics"",""A-Level Chemistry""],""AP"":[""AP Calculus AB or BC"",""AP Physics C: Mechanics"",""AP Chemistry""],""MYP"":[""MYP Sciences"",""MYP Mathematics""],""GCSE"":[""GCSE Mathematics"",""GCSE Physics"",""GCSE Chemistry""],""CBSE"":[""CBSE Physics"",""CBSE Chemistry"",""CBSE Mathematics""]}"
394,Engineering,Engineering Physics,"Engineering Physics is a major that combines the principles of physics and engineering to develop an understanding of the interrelationship between these two foundations. It is designed for students aiming to pursue innovative applications of physics in technological solutions, often leading to cutting-edge advancements.","Research Scientist, Systems Engineer, Data Analyst, Optical Engineer, Materials Scientist, Aerospace Engineer, Nuclear Engineer, Renewable Energy Engineer","{""IB"":[""IB Mathematics HL"",""IB Physics HL"",""IB Chemistry SL""],""A-Levels"":[""A-Level Mathematics"",""A-Level Further Mathematics"",""A-Level Physics""],""AP"":[""AP Calculus BC"",""AP Physics C: Mechanics"",""AP Physics C: Electricity and Magnetism""],""MYP"":[""MYP Extended Mathematics"",""MYP Physical and Earth Sciences""],""GCSE"":[""GCSE Mathematics"",""GCSE Physics"",""GCSE Further Mathematics""],""CBSE"":[""CBSE Physics"",""CBSE Mathematics"",""CBSE Chemistry""]}"
395,Engineering,Marine Engineering,"Marine Engineering is a specialized field of engineering that focuses on the design, construction, and maintenance of ships, boats, and other marine vessels and structures. This major combines principles from mechanical, electrical, and civil engineering to create and improve marine technology and infrastructure.","Ship engineer, Marine surveyor, Naval architect, Marine systems engineer, Offshore engineer, Environmental consultant, Port manager, Marine equipment designer","{""IB"":[""IB Mathematics HL"",""IB Physics HL"",""IB Design Technology SL"",""IB Chemistry SL""],""A-Levels"":[""A-Level Mathematics"",""A-Level Physics"",""A-Level Further Mathematics"",""A-Level Design and Technology""],""AP"":[""AP Calculus AB"",""AP Calculus BC"",""AP Physics C: Mechanics"",""AP Physics C: Electricity and Magnetism"",""AP Environmental Science""],""MYP"":[""MYP Design"",""MYP Physical and Earth Sciences"",""MYP Mathematics""],""GCSE"":[""GCSE Mathematics"",""GCSE Physics"",""GCSE Design and Technology""],""CBSE"":[""CBSE Physics"",""CBSE Mathematics"",""CBSE Chemistry"",""CBSE Engineering Graphics""]}"
396,Engineering,Railway Engineering,"Railway Engineering is a specialized field of engineering focusing on the design, construction, and operation of railway systems. It encompasses aspects of mechanical, civil, and electrical engineering to ensure efficient and safe transportation of goods and passengers.","Railway Project Manager, Transport Planner, Rail Operations Manager, Track Design Engineer, Signal Engineer, Maintenance Engineer, Rolling Stock Engineer, Safety Compliance Officer","{""IB"":[""IB Mathematics HL"",""IB Physics HL"",""IB Design Technology SL""],""A-Levels"":[""A-Level Mathematics"",""A-Level Physics"",""A-Level Further Mathematics""],""AP"":[""AP Calculus BC"",""AP Physics C: Mechanics"",""AP Statistics""],""MYP"":[""MYP Design"",""MYP Physical and Earth Sciences"",""MYP Mathematics""],""GCSE"":[""GCSE Mathematics"",""GCSE Physics"",""GCSE Design and Technology""],""CBSE"":[""CBSE Physics"",""CBSE Mathematics"",""CBSE Engineering Graphics""]}"
397,Engineering,Geological Engineering,"Geological Engineering is an interdisciplinary field that applies principles of geoscience to solve problems involving the Earth, its materials, and systems. This major combines aspects of geology, civil engineering, and environmental science to address issues related to resource extraction, natural hazards, and environmental protection.","Mining Engineer, Geotechnical Engineer, Environmental Consultant, Hydrogeologist, Petroleum Engineer, Seismic Risk Assessor, Geological Surveyor, Sustainability Advisor","{""IB"":[""IB Mathematics HL"",""IB Physics HL"",""IB Chemistry SL"",""IB Environmental Systems and Societies SL""],""A-Levels"":[""A-Level Mathematics"",""A-Level Physics"",""A-Level Chemistry"",""A-Level Geology""],""AP"":[""AP Calculus AB"",""AP Physics C: Mechanics"",""AP Chemistry"",""AP Environmental Science""],""MYP"":[""MYP Sciences"",""MYP Mathematics""],""GCSE"":[""GCSE Mathematics"",""GCSE Physics"",""GCSE Chemistry"",""GCSE Geography""],""CBSE"":[""CBSE Physics"",""CBSE Chemistry"",""CBSE Mathematics"",""CBSE Biology""]}"
398,Engineering,Nanoengineering,"Nanoengineering is a branch of engineering that deals with the design and manipulation of materials at the molecular and atomic levels to create new materials and devices with unique properties. This major focuses on the application of nanotechnology in various fields such as medicine, electronics, and materials science.","Nanotechnology researcher, Biomedical engineer, Pharmaceutical scientist, Materials scientist, Microfabrication engineer, Environmental, health, and safety officer, Quality control specialist","{""IB"":[""IB Chemistry HL"",""IB Physics HL"",""IB Mathematics HL"",""IB Design Technology SL""],""A-Levels"":[""A-Level Chemistry"",""A-Level Physics"",""A-Level Mathematics"",""A-Level Further Mathematics""],""AP"":[""AP Chemistry"",""AP Physics C: Mechanics"",""AP Calculus BC"",""AP Biology""],""MYP"":[""MYP Sciences"",""MYP Mathematics"",""MYP Design"",""MYP Physical and Health Education""],""GCSE"":[""GCSE Chemistry"",""GCSE Physics"",""GCSE Mathematics"",""GCSE Design and Technology""],""CBSE"":[""CBSE Chemistry"",""CBSE Physics"",""CBSE Mathematics"",""CBSE Biology""]}"
399,Engineering,Telecommunications Engineering,Telecommunications Engineering is a branch of engineering focused on the development and enhancement of telecommunication systems. This major involves the application of principles from electronics and computer science to support and improve telecommunication networks.,"Telecommunications engineer, Network engineer, Systems engineer, RF engineer, Communications consultant, Broadcast engineer, Technical support engineer","{""IB"":[""IB Mathematics HL"",""IB Physics HL"",""IB Computer Science SL""],""A-Levels"":[""A-Level Mathematics"",""A-Level Physics"",""A-Level Further Mathematics""],""AP"":[""AP Calculus AB"",""AP Physics C: Electricity and Magnetism"",""AP Computer Science A""],""MYP"":[""MYP Mathematics"",""MYP Design Technology"",""MYP Physical and Earth Sciences""],""GCSE"":[""GCSE Mathematics"",""GCSE Physics"",""GCSE Computer Science""],""CBSE"":[""CBSE Physics"",""CBSE Mathematics"",""CBSE Informatics Practices""]}"
400,Engineering,Manufacturing Engineering,"Manufacturing Engineering is a major focused on the design, development, and implementation of integrated systems for producing high-quality goods efficiently and safely. This field combines principles of engineering, technology, and management to optimize production processes and machinery.","Manufacturing Engineer, Quality Assurance Engineer, Production Manager, Industrial Designer, Process Engineer, Supply Chain Manager, Operations Manager, Robotics Engineer","{""IB"":[""IB Mathematics HL"",""IB Physics HL"",""IB Design Technology""],""A-Levels"":[""A-Level Mathematics"",""A-Level Physics"",""A-Level Design and Technology""],""AP"":[""AP Calculus AB"",""AP Physics C: Mechanics"",""AP Statistics""],""MYP"":[""MYP Design"",""MYP Mathematics"",""MYP Sciences""],""GCSE"":[""GCSE Mathematics"",""GCSE Physics"",""GCSE Design and Technology""],""CBSE"":[""CBSE Physics"",""CBSE Mathematics"",""CBSE Chemistry""]}"
